jayasoorya@jayasoorya-Satellite-C55-C:~/foss_git$ ./exp4.sh 
OS
NAME="Ubuntu"
VERSION="15.10 (Wily Werewolf)"
ID=ubuntu
ID_LIKE=debian
PRETTY_NAME="Ubuntu 15.10"
VERSION_ID="15.10"
HOME_URL="http://www.ubuntu.com/"
SUPPORT_URL="http://help.ubuntu.com/"
BUG_REPORT_URL="http://bugs.launchpad.net/ubuntu/"
Available Shells
# /etc/shells: valid login shells
/bin/sh
/bin/dash
/bin/bash
/bin/rbash
Mouse information
Keyboard Control:
  auto repeat:  on    key click percent:  0    LED mask:  00000002
  XKB indicators:
    00: Caps Lock:   off    01: Num Lock:    on     02: Scroll Lock: off
    03: Compose:     off    04: Kana:        off    05: Sleep:       off
    06: Suspend:     off    07: Mute:        off    08: Misc:        off
    09: Mail:        off    10: Charging:    off    11: Shift Lock:  off
    12: Group 2:     off    13: Mouse Keys:  off
  auto repeat delay:  500    repeat rate:  33
  auto repeating keys:  00ffffffdffffbbf
                        fadfffefffedffff
                        9fffffffffffffff
                        fff7ffffffffffff
  bell percent:  50    bell pitch:  400    bell duration:  100
Pointer Control:
  acceleration:  5/1    threshold:  5
Screen Saver:
  prefer blanking:  yes    allow exposures:  yes
  timeout:  0    cycle:  0
Colors:
  default colormap:  0x22    BlackPixel:  0x0    WhitePixel:  0xffffff
Font Path:
  /usr/share/fonts/X11/misc,/usr/share/fonts/X11/Type1,built-ins
DPMS (Energy Star):
  Standby: 0    Suspend: 0    Off: 0
  DPMS is Enabled
  Monitor is On
Memmory Information
MemTotal:        3964868 kB
MemFree:          894580 kB
MemAvailable:    2244540 kB
Buffers:          102916 kB
Cached:          1477280 kB
SwapCached:            0 kB
Active:          1943012 kB
Inactive:         891604 kB
Active(anon):    1256676 kB
Inactive(anon):   301988 kB
Active(file):     686336 kB
Inactive(file):   589616 kB
Unevictable:         256 kB
Mlocked:             256 kB
SwapTotal:       4112380 kB
SwapFree:        4112380 kB
Dirty:                 8 kB
Writeback:             0 kB
AnonPages:       1254688 kB
Mapped:           488688 kB
Shmem:            304248 kB
Slab:             140332 kB
SReclaimable:     103432 kB
SUnreclaim:        36900 kB
KernelStack:        9024 kB
PageTables:        38492 kB
NFS_Unstable:          0 kB
Bounce:                0 kB
WritebackTmp:          0 kB
CommitLimit:     6094812 kB
Committed_AS:    5819284 kB
VmallocTotal:   34359738367 kB
VmallocUsed:      545724 kB
VmallocChunk:   34358423548 kB
HardwareCorrupted:     0 kB
AnonHugePages:    522240 kB
CmaTotal:              0 kB
CmaFree:               0 kB
HugePages_Total:       0
HugePages_Free:        0
HugePages_Rsvd:        0
HugePages_Surp:        0
Hugepagesize:       2048 kB
DirectMap4k:      137856 kB
DirectMap2M:     3975168 kB
DirectMap1G:     1048576 kB 
Hard disk information
[sudo] password for jayasoorya: 
Driver: 
/dev/sda:

ATA device, with non-removable media
	Model Number:       TOSHIBA MQ01ABF050                      
	Serial Number:      25HPCIUOT
	Firmware Revision:  AM0P3M  
	Transport:          Serial, ATA8-AST, SATA 1.0a, SATA II Extensions, SATA Rev 2.5, SATA Rev 2.6
Standards:
	Supported: 8 7 6 5 
	Likely used: 8
Configuration:
	Logical		max	current
	cylinders	16383	16383
	heads		16	16
	sectors/track	63	63
	--
	CHS current addressable sectors:   16514064
	LBA    user addressable sectors:  268435455
	LBA48  user addressable sectors:  976773168
	Logical  Sector size:                   512 bytes
	Physical Sector size:                   512 bytes
	device size with M = 1024*1024:      476940 MBytes
	device size with M = 1000*1000:      500107 MBytes (500 GB)
	cache/buffer size  = 8192 KBytes
	Form Factor: 2.5 inch
	Nominal Media Rotation Rate: 5400
Capabilities:
	LBA, IORDY(can be disabled)
	Queue depth: 32
	Standby timer values: spec'd by Standard, no device specific minimum
	R/W multiple sector transfer: Max = 16	Current = 16
	Advanced power management level: 254
	DMA: sdma0 sdma1 sdma2 mdma0 mdma1 mdma2 udma0 udma1 udma2 udma3 udma4 *udma5 
	     Cycle time: min=120ns recommended=120ns
	PIO: pio0 pio1 pio2 pio3 pio4 
	     Cycle time: no flow control=120ns  IORDY flow control=120ns
Commands/features:
	Enabled	Supported:
	   *	SMART feature set
	    	Security Mode feature set
	   *	Power Management feature set
	   *	Write cache
	   *	Look-ahead
	   *	Host Protected Area feature set
	   *	WRITE_BUFFER command
	   *	READ_BUFFER command
	   *	NOP cmd
	   *	DOWNLOAD_MICROCODE
	   *	Advanced Power Management feature set
	    	Power-Up In Standby feature set
	   *	SET_FEATURES required to spinup after power up
	    	SET_MAX security extension
	   *	48-bit Address feature set
	   *	Device Configuration Overlay feature set
	   *	Mandatory FLUSH_CACHE
	   *	FLUSH_CACHE_EXT
	   *	SMART error logging
	   *	SMART self-test
	   *	General Purpose Logging feature set
	   *	WRITE_{DMA|MULTIPLE}_FUA_EXT
	   *	64-bit World wide name
	   *	IDLE_IMMEDIATE with UNLOAD
	   *	WRITE_UNCORRECTABLE_EXT command
	   *	{READ,WRITE}_DMA_EXT_GPL commands
	   *	Segmented DOWNLOAD_MICROCODE
	   *	Gen1 signaling speed (1.5Gb/s)
	   *	Gen2 signaling speed (3.0Gb/s)
	   *	Native Command Queueing (NCQ)
	   *	Host-initiated interface power management
	   *	Phy event counters
	   *	Idle-Unload when NCQ is active
	   *	DMA Setup Auto-Activate optimization
	    	Device-initiated interface power management
	   *	Software settings preservation
	   *	SMART Command Transport (SCT) feature set
	   *	SCT Write Same (AC2)
	   *	SCT Error Recovery Control (AC3)
	   *	SCT Features Control (AC4)
	   *	SCT Data Tables (AC5)
Security: 
	Master password revision code = 65534
		supported
	not	enabled
	not	locked
	not	frozen
	not	expired: security count
		supported: enhanced erase
	114min for SECURITY ERASE UNIT. 114min for ENHANCED SECURITY ERASE UNIT. 
Logical Unit WWN Device Identifier: 5000039613f0623b
	NAA		: 5
	IEEE OUI	: 000039
	Unique ID	: 613f0623b
Checksum: correct 
File mounted
 sysfs /sys sysfs rw,nosuid,nodev,noexec,relatime 0 0
proc /proc proc rw,nosuid,nodev,noexec,relatime 0 0
udev /dev devtmpfs rw,nosuid,relatime,size=1965088k,nr_inodes=491272,mode=755 0 0
devpts /dev/pts devpts rw,nosuid,noexec,relatime,gid=5,mode=620,ptmxmode=000 0 0
tmpfs /run tmpfs rw,nosuid,noexec,relatime,size=396488k,mode=755 0 0
/dev/sda7 / ext4 rw,relatime,errors=remount-ro,data=ordered 0 0
securityfs /sys/kernel/security securityfs rw,nosuid,nodev,noexec,relatime 0 0
tmpfs /dev/shm tmpfs rw,nosuid,nodev 0 0
tmpfs /run/lock tmpfs rw,nosuid,nodev,noexec,relatime,size=5120k 0 0
tmpfs /sys/fs/cgroup tmpfs rw,mode=755 0 0
cgroup /sys/fs/cgroup/systemd cgroup rw,nosuid,nodev,noexec,relatime,xattr,release_agent=/lib/systemd/systemd-cgroups-agent,name=systemd 0 0
pstore /sys/fs/pstore pstore rw,nosuid,nodev,noexec,relatime 0 0
efivarfs /sys/firmware/efi/efivars efivarfs rw,nosuid,nodev,noexec,relatime 0 0
cgroup /sys/fs/cgroup/memory cgroup rw,nosuid,nodev,noexec,relatime,memory 0 0
cgroup /sys/fs/cgroup/net_cls,net_prio cgroup rw,nosuid,nodev,noexec,relatime,net_cls,net_prio 0 0
cgroup /sys/fs/cgroup/perf_event cgroup rw,nosuid,nodev,noexec,relatime,perf_event,release_agent=/run/cgmanager/agents/cgm-release-agent.perf_event 0 0
cgroup /sys/fs/cgroup/cpuset cgroup rw,nosuid,nodev,noexec,relatime,cpuset,clone_children 0 0
cgroup /sys/fs/cgroup/cpu,cpuacct cgroup rw,nosuid,nodev,noexec,relatime,cpu,cpuacct 0 0
cgroup /sys/fs/cgroup/blkio cgroup rw,nosuid,nodev,noexec,relatime,blkio 0 0
cgroup /sys/fs/cgroup/hugetlb cgroup rw,nosuid,nodev,noexec,relatime,hugetlb,release_agent=/run/cgmanager/agents/cgm-release-agent.hugetlb 0 0
cgroup /sys/fs/cgroup/devices cgroup rw,nosuid,nodev,noexec,relatime,devices 0 0
cgroup /sys/fs/cgroup/freezer cgroup rw,nosuid,nodev,noexec,relatime,freezer 0 0
systemd-1 /proc/sys/fs/binfmt_misc autofs rw,relatime,fd=23,pgrp=1,timeout=0,minproto=5,maxproto=5,direct 0 0
mqueue /dev/mqueue mqueue rw,relatime 0 0
debugfs /sys/kernel/debug debugfs rw,relatime 0 0
hugetlbfs /dev/hugepages hugetlbfs rw,relatime 0 0
fusectl /sys/fs/fuse/connections fusectl rw,relatime 0 0
tracefs /sys/kernel/debug/tracing tracefs rw,relatime 0 0
/dev/sda2 /boot/efi vfat rw,relatime,fmask=0077,dmask=0077,codepage=437,iocharset=iso8859-1,shortname=mixed,errors=remount-ro 0 0
cgmfs /run/cgmanager/fs tmpfs rw,relatime,size=100k,mode=755 0 0
tmpfs /run/user/1000 tmpfs rw,nosuid,nodev,relatime,size=396488k,mode=700,uid=1000,gid=1000 0 0
gvfsd-fuse /run/user/1000/gvfs fuse.gvfsd-fuse rw,nosuid,nodev,relatime,user_id=1000,group_id=1000 0 0

